{
  "schema_version": "document_version_lifecycle_v1",
  "paper_id": "paper_001",
  "document_id": "doc_001",
  "owner_id": "owner_001",
  "document_version_id": "document_version_001",
  "content_sha256": "aaaaaaaaaaaaaaaaaaaaaaaaaaaaaaaaaaaaaaaaaaaaaaaaaaaaaaaaaaaaaaaa",
  "source_snapshot_sha256": "bbbbbbbbbbbbbbbbbbbbbbbbbbbbbbbbbbbbbbbbbbbbbbbbbbbbbbbbbbbbbbbb",
  "parse_version": "parser_section_parent_child_v1",
  "lifecycle_revision": 1,
  "lifecycle_status": "READY",
  "parse_finish_time": "2026-07-22T00:01:00Z",
  "chunk_splitter_time": "2026-07-22T00:01:10Z",
  "chunk_create_time": "2026-07-22T00:01:20Z",
  "chunk_gen_time": "2026-07-22T00:01:30Z",
  "vector_index_time": "2026-07-22T00:02:00Z",
  "index_states": {
    "elasticsearch_chunks": "READY",
    "milvus_vectors": "READY"
  },
  "delete_time": null,
  "chunk_expire_time": null,
  "last_access_time": null,
  "last_refresh_time": null,
  "failure_code": null,
  "updated_at": "2026-07-22T00:02:00Z"
}
